urun_adi,fiyat,resim_url
Armaf Club De Nuit Intense Erkek Parfüm EDT 105 ML,2000.0,https://n11scdn.akamaized.net/static/css/jquery/img/blank.gif
Bentley Azure Erkek Parfüm EDT 100 ML,2000.0,https://n11scdn.akamaized.net/static/css/jquery/img/blank.gif
Avon Perceive Edt Erkek - 5 x 100 ML,2000.0,https://n11scdn.akamaized.net/static/css/jquery/img/blank.gif
Bentley Black Edition Erkek Parfüm EDP 100 ML,2000.0,https://n11scdn.akamaized.net/static/css/jquery/img/blank.gif
Lalique Encre Noire Sport Erkek Parfüm EDT 100 ML,2020.9,https://n11scdn.akamaized.net/static/css/jquery/img/blank.gif
Bentley Become Edp 60 Ml 7640473480096 Odunsu,2047.5,https://n11scdn.akamaized.net/static/css/jquery/img/blank.gif
Osmanlı Oud Blue Motion Unisex Parfüm EDP 85 ML,2050.0,https://n11scdn.akamaized.net/static/css/jquery/img/blank.gif
Osmanlı Oud Golden Leaf EDP Kadın - Erkek Parfüm 4070 85 ML,2050.0,https://n11scdn.akamaized.net/static/css/jquery/img/blank.gif
Farmasi Gaucho Bay Parfüm 100 Ml,2100.0,https://n11scdn.akamaized.net/static/css/jquery/img/blank.gif
Lalique White In Black Erkek Parfüm EDP 125 ML,2145.0,https://n11scdn.akamaized.net/static/css/jquery/img/blank.gif
Lalique Encre Indigo Erkek Parfüm EDP 100 ML,2145.0,https://n11scdn.akamaized.net/static/css/jquery/img/blank.gif
Tommy Hilfiger EST.1985 Erkek Parfüm EDT 100 ML,2152.8,https://n11scdn.akamaized.net/a1/226_339/09/43/20/66/IMG-1801398976433922968.jpg
Bentley Intense Erkek Parfüm EDP 100 ML,2250.0,https://n11scdn.akamaized.net/a1/226_339/06/21/46/49/IMG-7978970649327280169.jpg
Bentley For Men Silver Lake Erkek Parfüm EDP 100 ML,2250.0,https://n11scdn.akamaized.net/static/css/jquery/img/blank.gif
Versace Blue Jeans Erkek Parfüm EDT 75 ML,2334.3,https://n11scdn.akamaized.net/static/css/jquery/img/blank.gif
Burberry Classic For Men Edt 100 ml (Yeni),2400.0,https://n11scdn.akamaized.net/static/css/jquery/img/blank.gif
Calvin Klein One Unisex Parfüm EDT 200 ML,2415.9,https://n11scdn.akamaized.net/static/css/jquery/img/blank.gif
Lalique Lion Erkek Parfüm EDP 125 ML,2475.0,https://n11scdn.akamaized.net/static/css/jquery/img/blank.gif
Rochas Intense Erkek Parfüm EDT 100 ML,2499.0,https://n11scdn.akamaized.net/a1/226_339/04/91/22/82/IMG-7507222685128471815.jpg
Slazenger Gold + Active Sport Yeşil + Mavi Parfüm EDT 3 x 125 ML + Deodorant 3 x 150 ML,2499.99,https://n11scdn.akamaized.net/a1/226_339/14/42/55/33/IMG-1563779830227637044.jpg
Davidoff Cool Water Erkek Parfüm EDT 125 ML,2500.0,https://n11scdn.akamaized.net/a1/226_339/06/03/56/69/IMG-8763004534728174602.jpg
Jean Paul Gaultier Scandal Pour Homme Erkek Parfüm EDT 100 ML,2511.0,https://n11scdn.akamaized.net/a1/226_339/14/87/76/54/IMG-472750909516094174.jpg
Lattafa Khamrah Qahwa EDP 100 ML,2750.0,https://n11scdn.akamaized.net/static/css/jquery/img/blank.gif
Bentley Become Edp 100 Ml 7640473480089 Odunsu,2778.75,https://n11scdn.akamaized.net/static/css/jquery/img/blank.gif
David Walker Boutique Masculine Erkek Parfüm EDP 50 ML,2800.0,https://n11scdn.akamaized.net/static/css/jquery/img/blank.gif
Lalique Encre Noire Erkek Parfüm EDT 100 ML,3000.0,https://n11scdn.akamaized.net/static/css/jquery/img/blank.gif
Emporio Armani Stronger With You Intensely Erkek Parfüm EDP 100 ML,3200.0,https://n11scdn.akamaized.net/static/css/jquery/img/blank.gif
Mont Blanc Explorer Erkek Parfüm EDP 100 ML,3250.0,https://n11scdn.akamaized.net/static/css/jquery/img/blank.gif
Hawas Erkek Parfüm EDP 100 ML,3250.0,https://n11scdn.akamaized.net/static/css/jquery/img/blank.gif
Christian Dior Sauvage Erkek Parfüm EDT 60ML,3392.9,https://n11scdn.akamaized.net/static/css/jquery/img/blank.gif
Paco Rabanne Invictus Erkek Parfüm EDT 100 ML,3400.0,https://n11scdn.akamaized.net/static/css/jquery/img/blank.gif
Burberry Classic Erkek Parfüm EDT 100 ML,3486.0,https://n11scdn.akamaized.net/static/css/jquery/img/blank.gif
Calvin Klein Eternity Erkek Parfüm EDT 100 ML,3500.0,https://n11scdn.akamaized.net/static/css/jquery/img/blank.gif
Hugo Boss Hugo Man Erkek Parfümü EDT 200 ML,3600.0,https://n11scdn.akamaized.net/static/css/jquery/img/blank.gif
Ralph Lauren Polo Blue Erkek Parfüm EDT 125 ML,3650.0,https://n11scdn.akamaized.net/static/css/jquery/img/blank.gif
Versace Dylan Blue Erkek Parfüm EDT 100 ML,3750.0,https://n11scdn.akamaized.net/static/css/jquery/img/blank.gif
Versace Eros Erkek Parfüm EDP 100 ML,3900.0,https://n11scdn.akamaized.net/static/css/jquery/img/blank.gif
Emporio Armani Diamonds Erkek Parfüm EDT 75 ML,3950.0,https://n11scdn.akamaized.net/static/css/jquery/img/blank.gif
Armaf Club De Nuit Intense Man Parfum Limited Edition 105ml,3950.0,https://n11scdn.akamaized.net/static/css/jquery/img/blank.gif
French Avenue Liquid Brun Erkek Parfüm EDP 100 ML,3950.0,https://n11scdn.akamaized.net/static/css/jquery/img/blank.gif
Armaf Club De Nuit Intense Erkek Parfüm EDP 200 ML,4000.0,https://n11scdn.akamaized.net/static/css/jquery/img/blank.gif
Kenzo Homme Erkek Parfüm EDP 110 ML,4227.0,https://n11scdn.akamaized.net/static/css/jquery/img/blank.gif
Al Haramain Amber Oud Aqua Dubai Erkek Parfüm EDP 100 ML,4250.0,https://n11scdn.akamaized.net/static/css/jquery/img/blank.gif
Armaf Club De Nuit Intense Erkek Parfüm EDP 150 ML,4250.0,https://n11scdn.akamaized.net/static/css/jquery/img/blank.gif
Kenzo Homme Marine Erkek Parfüm EDT 110 ML,4260.0,https://n11scdn.akamaized.net/a1/226_339/11/70/59/40/IMG-8647818148829005463.jpg
Blade Cooler Erkek Parfüm EDT 100 ML + Deodorant 150 ML,4320.0,https://n11scdn.akamaized.net/static/css/jquery/img/blank.gif
Hugo Boss Bottled Absolu Erkek Parfüm EDP 50 ML,4323.0,https://n11scdn.akamaized.net/static/css/jquery/img/blank.gif
Christian Dior Sauvage Erkek Parfüm EDT 100 ML,4600.0,https://n11scdn.akamaized.net/static/css/jquery/img/blank.gif
Versace Eros Energy Erkek Parfüm EDP 200 ML,5131.0,https://n11scdn.akamaized.net/static/css/jquery/img/blank.gif
Christian Dior Homme Intense EDP Erkek Parfüm 100 ML,5250.0,https://n11scdn.akamaized.net/static/css/jquery/img/blank.gif
Christian Dior Homme Erkek Parfüm EDT 100 ML,5425.0,https://n11scdn.akamaized.net/static/css/jquery/img/blank.gif
Christian Dior Sauvage Parfum Erkek Parfüm EDP 100 ML,5470.0,https://n11scdn.akamaized.net/static/css/jquery/img/blank.gif
Issey Miyake L'Eau D'Issey Erkek Parfüm EDT 200 ML,5500.0,https://n11scdn.akamaized.net/static/css/jquery/img/blank.gif
Dolce&Gabbana Light Blue Intense Erkek Parfüm EDP 100 ML,5500.0,https://n11scdn.akamaized.net/static/css/jquery/img/blank.gif
Emporio Armani Stronger With You Intensely Edp 150 Ml 3614274347388 Odunsu,5950.0,https://n11scdn.akamaized.net/static/css/jquery/img/blank.gif
Christian Dior Homme Intense Erkek Parfüm EDP 150 ML,6450.0,https://n11scdn.akamaized.net/static/css/jquery/img/blank.gif
Hermes Terre Dhermes Intense Edp 100 Ml 3346130424116 Odunsu,6930.0,https://n11scdn.akamaized.net/static/css/jquery/img/blank.gif
Versace Eros Flame Erkek Parfüm EDP 200 ML,7200.0,https://n11scdn.akamaized.net/static/css/jquery/img/blank.gif
Versace Eros Erkek Parfüm EDP 200 ML,7400.0,https://n11scdn.akamaized.net/a1/226_339/14/02/36/44/IMG-6279930815855528417.jpg
Giorgio Armani Acqua Di Gio Erkek Parfüm Refill 200 ML,7500.0,https://n11scdn.akamaized.net/static/css/jquery/img/blank.gif
Yves Saint Laurent La Nuit De L'Homme Erkek Parfüm EDT 200 ML,7605.0,https://n11scdn.akamaized.net/static/css/jquery/img/blank.gif
Sospiro Vibrato Erkek Parfüm EDP 100 ML,12620.0,https://n11scdn.akamaized.net/static/css/jquery/img/blank.gif
Nishane Hacivat X Erkek Parfüm EDP 100 ML,14950.0,https://n11scdn.akamaized.net/static/css/jquery/img/blank.gif
Afnan Turathi Blue Erkek Parfüm EDP 90 ML,,https://n11scdn.akamaized.net/static/css/jquery/img/blank.gif
Dunlop Klasik Yeşil Erkek Parfüm EDT 100 ML,,https://n11scdn.akamaized.net/static/css/jquery/img/blank.gif
Rasasi Hawas Ice Erkek Parfüm EDP 100 ML,,https://n11scdn.akamaized.net/a1/226_339/15/62/04/43/IMG-5836005864312604765.png
Issey Miyake L'Eau D'Issey Intense Erkek Parfüm EDT 125 ML,,https://n11scdn.akamaized.net/static/css/jquery/img/blank.gif
